{
  "version": "1.0",
  "id": "00000000-0000-0000-0000-000000000000",
  "created_at": "2026-01-04T00:00:00.000Z",
  "type": "fix",
  "priority": "medium",
  "title": "Fix: <short title>",
  "instructions": "Implement the fix. Keep changes minimal, safe, and well-documented.",
  "scope": {
    "paths": ["./path/to/file-or-folder"],
    "notes": ""
  },
  "execution": {
    "allowed": { "read": true, "write": true, "execute": false, "network": false },
    "commands": []
  },
  "constraints": {
    "no_secrets": true,
    "do_not_push": true,
    "do_not_change_git_config": true
  },
  "routing": {
    "targets": [
      { "name": "cursor", "mode": "paste-prompt", "notes": "Use as a Cursor agent prompt." }
    ],
    "github": { "create_issue": false, "labels": ["agent-request", "fix"], "assignees": [] }
  }
}
