{
  "version": "1.0",
  "id": "00000000-0000-0000-0000-000000000000",
  "created_at": "1970-01-01T00:00:00Z",
  "type": "review",
  "priority": "medium",
  "title": "Review <what> (e.g., scripts, docs, PR, logs)",
  "instructions": "State what to review, what good looks like, and the desired output (summary, checklist, patch, etc.).",
  "scope": {
    "paths": [],
    "notes": ""
  },
  "execution": {
    "allowed": {
      "read": true,
      "write": false,
      "execute": false,
      "network": false
    },
    "commands": []
  },
  "constraints": {
    "no_secrets": true,
    "do_not_push": true,
    "do_not_change_git_config": true
  },
  "routing": {
    "targets": [
      {
        "name": "cursor",
        "mode": "paste-prompt",
        "notes": ""
      }
    ],
    "github": {
      "create_issue": false,
      "labels": ["agent-request", "review"],
      "assignees": []
    }
  }
}
